<?xml version="1.0" encoding="UTF-8"?>

<!-- We define validation rules by W3C XML Schema validation (see zooinventory.xsd): -->
<inventory
	xmlns="https://www.zooinventory.com"
	xmlns:xsi="http://www.w3.org/2001/XMLSchema-instance"
	xsi:schemaLocation="https://www.zooinventory.com zooinventory.xsd">

	<animal animalClass="mammal">
        <name>Song Fang</name>
        <species>Giant Panda</species>
        <habitat>China</habitat> 
        <food>Bamboo</food>
        <temperament>Friendly</temperament>
        <weight>33.0</weight>
    </animal>
    
    <animal animalClass="mammal">
        <name>Cocoa</name>
        <species>Gorilla</species>
        <habitat>Central Africa</habitat>
        <foodRecipe>
            <name>Gorilla Chow</name>
            <ingredient>fruit</ingredient>
            <ingredient>shoots</ingredient>
            <ingredient>leaves</ingredient>
        </foodRecipe>
        <temperament>Know-it-all</temperament>
        <weight>45.0</weight>
    </animal>
    
</inventory>